{
  "schemaVersion": 1,
  "name": "dtc-requirements-analysis",
  "version": "1.0.0",
  "description": "把想法、会议材料、缺陷或配置请求整理成范围清晰、可验收、可交接的需求记录。",
  "stage": "discovery",
  "inputs": [
    "context",
    "业务输入",
    "已有实现或文档证据"
  ],
  "outputs": [
    "需求记录",
    "AC 验收标准",
    "待确认项",
    "下游影响"
  ],
  "privacy": "不把客户记录、凭据或内部技术细节写入业务文档",
  "entrypoint": "SKILL.md",
  "$schema": "../../schemas/skill.schema.json",
  "relatedSkills": [
    "dtc-context",
    "dtc-privacy-redaction"
  ]
}
