{
  "schemaVersion": 1,
  "name": "dtc-visual-validation",
  "version": "1.1.0",
  "description": "对照采用的设计目标验证实际画面，控制平台/视口/内容/状态与字体素材，保留差异修复闭环；适用于 Web 和原生 UI。",
  "stage": "verify",
  "inputs": [
    "采用目标与 UI 规格",
    "候选及真实渲染",
    "比较环境和状态"
  ],
  "outputs": [
    "截图/并排比较结论",
    "差异记录及复测",
    "沿用依据或待验项"
  ],
  "relatedSkills": [
    "dtc-ui-spec",
    "dtc-implementation",
    "dtc-component-testing",
    "dtc-scoped-validation",
    "dtc-evidence-log"
  ],
  "privacy": "真实源材料留在目标项目受控位置；公开内容先脱敏",
  "entrypoint": "SKILL.md",
  "$schema": "../../schemas/skill.schema.json"
}
