{
  "schemaVersion": 1,
  "name": "dtc-privacy-redaction",
  "version": "1.0.0",
  "description": "在日志、截图、代码片段、录屏和公开示例进入分享仓库前擦除秘密、个人信息、内部定位和商业敏感信息。",
  "stage": "safety",
  "inputs": [
    "原始素材",
    "公开目标",
    "需要保留的流程关系"
  ],
  "outputs": [
    "脱敏素材",
    "redaction-report.md",
    "脱敏后哈希（可选）"
  ],
  "privacy": "本 skill 默认不输出原始敏感内容",
  "entrypoint": "SKILL.md",
  "$schema": "../../schemas/skill.schema.json",
  "relatedSkills": []
}
