{
  "schemaVersion": 1,
  "name": "dtc-component-testing",
  "version": "1.1.0",
  "description": "依据页面/原子组件契约落实参数、场景、交互和兼容测试；首次覆盖全部适用分支，增量变更按消费者裁剪。",
  "stage": "verify",
  "inputs": [
    "UI/参数/行为契约",
    "状态矩阵与消费者",
    "当前候选及测试能力"
  ],
  "outputs": [
    "适用测试清单",
    "实际操作断言和结果",
    "旧消费者回归",
    "失败闭环及缺口"
  ],
  "relatedSkills": [
    "dtc-ui-spec",
    "dtc-implementation",
    "dtc-visual-validation",
    "dtc-scoped-validation",
    "dtc-evidence-log"
  ],
  "privacy": "真实源材料留在目标项目受控位置；公开内容先脱敏",
  "entrypoint": "SKILL.md",
  "$schema": "../../schemas/skill.schema.json"
}
