{
  "schemaVersion": 1,
  "name": "dtc-technical-design",
  "version": "1.0.0",
  "description": "将需求和设计证据转成组件边界、数据接口、配置兼容、生产构建与验证方案；用于实现前评估，不自动写业务代码。",
  "stage": "design",
  "inputs": [
    "目标与范围",
    "来源证据或缺口",
    "当前实现"
  ],
  "outputs": [
    "技术契约",
    "方案决定与风险",
    "验证范围"
  ],
  "relatedSkills": [
    "dtc-context",
    "dtc-requirements-analysis",
    "dtc-design-evidence",
    "dtc-implementation",
    "dtc-page-decomposition",
    "dtc-atomic-decomposition",
    "dtc-ui-spec"
  ],
  "privacy": "公开输出仅保留脱敏证据",
  "entrypoint": "SKILL.md",
  "$schema": "../../schemas/skill.schema.json"
}
