{
  "schemaVersion": 1,
  "name": "dtc-scoped-validation",
  "version": "1.1.0",
  "description": "依据实际改动与消费者选择验证层次和适用范围，区分首次全适用覆盖、增量沿用、构建校验和未测风险。",
  "stage": "verify",
  "inputs": [
    "diff 和真实消费者",
    "已有验证/项目要求",
    "候选与风险"
  ],
  "outputs": [
    "本轮范围及沿用理由",
    "分类结果与未测项",
    "候选绑定的验证摘要"
  ],
  "relatedSkills": [
    "dtc-component-testing",
    "dtc-visual-validation",
    "dtc-delivery",
    "dtc-optimization",
    "dtc-data-tracking"
  ],
  "privacy": "真实源材料留在目标项目受控位置；公开内容先脱敏",
  "entrypoint": "SKILL.md",
  "$schema": "../../schemas/skill.schema.json"
}
