{
  "schemaVersion": 1,
  "name": "dtc-recording-analysis",
  "version": "1.0.0",
  "description": "把脱敏后的真实开发证据整理成适合小红书等公开渠道的录屏、旁白、字幕和发布前检查。",
  "stage": "publishing",
  "inputs": [
    "dtc-privacy-redaction output",
    "dtc-evidence-log output",
    "一个具体问题"
  ],
  "outputs": [
    "recording outline",
    "shot list",
    "voiceover/captions",
    "publication checklist"
  ],
  "privacy": "只使用公开素材、占位符和合成数据",
  "entrypoint": "SKILL.md",
  "$schema": "../../schemas/skill.schema.json",
  "relatedSkills": [
    "dtc-privacy-redaction",
    "dtc-evidence-log"
  ]
}
