{
  "$schema": "../../schemas/skill.schema.json",
  "schemaVersion": 1,
  "name": "dtc-optimization",
  "version": "1.0.0",
  "description": "在功能、视觉和测试通过后，基于测量证据优化组件架构、性能、可维护性和开发反馈回路，避免凭感觉重构。",
  "stage": "optimize",
  "inputs": [
    "validated candidate",
    "performance/quality measurements",
    "failure and feedback evidence",
    "maintenance costs"
  ],
  "outputs": [
    "optimization hypothesis",
    "before/after measurements",
    "scoped change",
    "regression results",
    "follow-up observation"
  ],
  "relatedSkills": [
    "dtc-component-testing",
    "dtc-visual-validation",
    "dtc-scoped-validation",
    "dtc-workflow-review",
    "dtc-evidence-log"
  ],
  "privacy": "公开输出仅使用脱敏设计、合成数据和占位符",
  "entrypoint": "SKILL.md"
}
